{"compatibility":{"backends":{"pems-cove":["pems/2","cove/1"]},"project_knowledge_package":["project-knowledge-package/1"],"rgp":["rgp/1"]},"content_identity":"sha256:ee0df2a91316ed0fa803d690b3e1b5bf6e07a320319255458e68ed1fb02b2dad","contract":"reasoning-distiller-install-package/1","files":[{"mode":"0644","path":"admission/apply_admission_transaction.py","sha256":"852dbcfaa8f33186ed8c6e0b76783764af26fd8be82e636350a8fd9e33648844"},{"mode":"0644","path":"admission/apply_admission_transaction_v2.py","sha256":"9344985a12c57bf83b60d07a4e4fbb274dd94a54c2acf3a00f073b402237d5a3"},{"mode":"0644","path":"admission/test_admission_transaction_v2.py","sha256":"ee39f288bc24c7e73fba82972767a59f5d65fa401e9ed9a28f96ddb94b15c3d5"},{"mode":"0644","path":"agents/architect/DIRECTIVE.md","sha256":"6a8b9bde884c15e12161edc95c28978a9d3172a35b5bd76941c2df27de3a8573"},{"mode":"0644","path":"agents/distiller/DIRECTIVE.md","sha256":"1b1bc90c4cb3c4bbed73d9095fdec6c08069dbae664386a58f4f581da8f0a9a4"},{"mode":"0644","path":"agents/engineer/DIRECTIVE.md","sha256":"c8ab9668f2a54c9dd27887517a541ba98a0796be74a4cf96d13b1fd783204c7e"},{"mode":"0644","path":"agents/steward/DIRECTIVE.md","sha256":"09cfc19c7a9550079becfe811dfcc3d382ebe7839776aef7f1ad81a83ed74a11"},{"mode":"0644","path":"backends/pems-cove/ADMISSION_FIXTURES.json","sha256":"7bddb5aa845c12cf655e25ce2b0aac95f4cada725bf6a290979c1d0e22534118"},{"mode":"0644","path":"backends/pems-cove/RGP_COMPATIBILITY_FIXTURES.json","sha256":"797d79d3f0a3fe5800d064dd49ecc881ad6f9ed1f45f18213576ec0825832591"},{"mode":"0644","path":"backends/pems-cove/RGP_UNCERTAINTY_IMPORT_FIXTURES.json","sha256":"3f1e131995eb8d026865e82734412f8de08892991b5547bcfdbd12881471752b"},{"mode":"0644","path":"backends/pems-cove/pems-v2.schema.json","sha256":"b08e592ab7c10092ff381fe8057cac63ccb7aaa077b52532f5ee609c6fd279c3"},{"mode":"0644","path":"backends/pems-cove/validate_pems2_contract.py","sha256":"50cb0d10168a47f7ff377b3194d9e086712cd38e22f6f868ddbab7e9538ac8d8"},{"mode":"0644","path":"backends/pems-cove/validate_rgp_uncertainty_import.py","sha256":"3db1bff68cf704d5f94b251246b03bf00f0e5db1f8d29d8b1437e078dc0294b1"},{"mode":"0644","path":"protocols/reconciliation/RECONCILIATION_EVIDENCE_PROTOCOL.md","sha256":"438005b615202ae7e3686d42384e4941c17c2c5ddcaf534a8bc37951fa03ab3a"},{"mode":"0644","path":"protocols/rgp/SUBMISSION_PROTOCOL.md","sha256":"6f806e195920f64560143abf2ba4db89c5e6437aa40f639ff651f53de8192bbf"},{"mode":"0644","path":"schemas/install-package-manifest.schema.json","sha256":"51155308d2f6e5e24d315e1473f85d7fe9e524f88b0ad48747808563b3072a0f"},{"mode":"0644","path":"schemas/installation-record.schema.json","sha256":"cd41839f9feafad37a2065f3966c4d59ef3c8b10781f60086e379df6d8c6ade2"},{"mode":"0644","path":"schemas/project-package.schema.json","sha256":"9a419c556c1270123725faa0951cd5017fa7bbb9d17528db17394f8c343c770d"},{"mode":"0644","path":"schemas/rgp-output.schema.json","sha256":"427439a732565f2b0c05b3477b19b059f7a8214096c38e7d08488af404dbce10"},{"mode":"0644","path":"validators/rgp_validator.py","sha256":"fc3629415ade16d10f1eb46897fc0800d1a71b8b64ed23fab34fe95da507fdb5"},{"mode":"0644","path":"validators/validate_distillation.py","sha256":"324ee53ed6ae91bcc23fe40df8826df11736ad7558241b8843823ae0952adee5"}],"managed_roots":["admission","agents","backends","protocols","schemas","validators"],"source_commit":"8d81967b3f93e825172d961267818238fffc7d38","transport_sha256":"773ab0c9a5946f69ec568aabd9a255569f9511227142baadde077f826aa6cd8a","version":"0.1.0"}
